{
  "schema_version": "task-contract.v1",
  "model_mode": "laguna_xs_worker",
  "task_type": "single_file_patch",
  "goal": "Patch tests/api_client_test.py to mock HTTP calls in test_fetch_current_weather using the responses library.",
  "context_packet": {
    "files": [
      {
        "path": "tests/api_client_test.py",
        "why": "test file making live HTTP requests that need mocking"
      },
      {
        "path": "api_client.py",
        "why": "WeatherClient implementation showing the API structure and endpoint"
      },
      {
        "path": "requirements.txt",
        "why": "confirms responses==0.24.1 is available for mocking"
      },
      {
        "path": "pytest.ini",
        "why": "pytest configuration defining test discovery patterns"
      },
      {
        "path": "bug-report.md",
        "why": "describes the flaky network issue and expected JSON response shape"
      }
    ],
    "commands": [
      "pytest tests/api_client_test.py"
    ],
    "logs": []
  },
  "scope": {
    "paths": [
      "tests/api_client_test.py"
    ],
    "max_files_to_modify": 1
  },
  "constraints": {
    "output_format": "unified_diff",
    "must_not": [
      "modify api_client.py or other non-test files",
      "change existing test assertions",
      "introduce real network calls",
      "add dependencies beyond responses library"
    ]
  },
  "acceptance": {
    "checks": [
      {
        "type": "patch_apply",
        "target_path": "tests/api_client_test.py"
      },
      {
        "type": "test_result",
        "command": "pytest tests/api_client_test.py"
      }
    ]
  },
  "repair_policy": {
    "max_repairs": 1,
    "return_only_corrected_output": true
  },
  "escalation": "stop_and_report"
}
